[
  {
    "imgMain": "https://static-1.ivoox.com/canales/f/d/2/7/fd27a1f3dd4a0478e921cace5476381c_XXL.jpg",
    "title": "La Victoria esférica. Qué pasen los Bills. (T. 6. Ep. 4)",
    "description": "Fer y Tigrillo sacan las pocas conclusiones que se pueden sacar de un partido an\u0026oacute;malo, sin rival en frente. Adem\u0026aacute;s, realizamos una peque\u0026ntilde;a previa del partido contra Bills.\r\n\r\n1. Ataque perfecto,  defensa apa\u0026ntilde;ada\r\n2. 10 estad\u0026iacute;sticas que explican los n\u0026uacute;meros\r\n3. Rotaci\u0026oacute;n de jugadores, no baja el rendimiento.\r\n\r\n#FinsUp #NFL #MiamiDolphins #MundoDolphins #",
    "dateAndTime": "2023-09-28T09:43:42Z",
    "link": "https://www.ivoox.com/victoria-esferica-que-pasen-bills-t-audios-mp3_rf_116811631_1.html",
    "audio": "https://www.ivoox.com/victoria-esferica-que-pasen-bills-t_mf_116811631_feed_1.mp3",
    "len": "01:03:00"
  },
  {
    "imgMain": "https://static-1.ivoox.com/canales/f/d/2/7/fd27a1f3dd4a0478e921cace5476381c_XXL.jpg",
    "title": "La partida de Ajedrez. 2-0 y a correr (T6 P 3)",
    "description": "Gran partido t\u0026aacute;ctico entre McDaniel y Bellichick. Vienen a cont\u0026aacute;rnoslo Fer y Tigrillo. Nueva victoria, esta vez a un rival divisional, y nos ponemos seed 2 de la AFC\r\n\r\n1. AVG, de que planeta viniste.\r\n2. 31 en blizt, 3ro en presiones. Con ustedes Vic Fangio\r\n3. El mago McDaniel. Nada por aqu\u0026iacute;, nada por all\u0026aacute;, touchdown\r\n#NFL #MiamiDolphins #FinsUp",
    "dateAndTime": "2023-09-20T22:17:50Z",
    "link": "https://www.ivoox.com/partida-ajedrez-2-0-a-correr-audios-mp3_rf_116384786_1.html",
    "audio": "https://www.ivoox.com/partida-ajedrez-2-0-a-correr_mf_116384786_feed_1.mp3",
    "len": "01:14:53"
  },
  {
    "imgMain": "https://static-1.ivoox.com/canales/f/d/2/7/fd27a1f3dd4a0478e921cace5476381c_XXL.jpg",
    "title": "Estreno de RS con Victoria (1-0). Partido estrella de la jornada",
    "description": "Vuelve el football a nuestras vidas, y llega la primera victoria de los Miami Dolphins.\r\n\u0026Aacute;ngel y Fer nos hablan del ataque de los Dolphins, de su defensa, o falta de ella, y que esperar del equipo estas primeras jornadas.\r\n\r\n- La mejora de la l\u0026iacute;nea ofensiva. Cambios vs Pats?\r\n- Llega la Quick motion. Qu\u0026eacute; es y c\u0026oacute;mo verla.\r\n- N\u0026uacute;meros y cosas. \u0026iquest;Por qu\u0026eacute; parece que Waddle no estuvo?\r\n- El juego de carrera ausente. Por qu\u0026eacute;?\r\n- Defensa de juego de carrera. \u0026iquest;Estuvo mal o fue una opci\u0026oacute;n de la defensa?\r\n- Vic Fangio tiene trabajo.\r\n- Previa Pats: Defensa \u0026eacute;lite, ataque de parvulario",
    "dateAndTime": "2023-09-13T19:03:17Z",
    "link": "https://www.ivoox.com/estreno-rs-victoria-1-0-partido-estrella-audios-mp3_rf_115986957_1.html",
    "audio": "https://www.ivoox.com/estreno-rs-victoria-1-0-partido-estrella_mf_115986957_feed_1.mp3",
    "len": "01:13:14"
  },
  {
    "imgMain": "https://static-1.ivoox.com/canales/f/d/2/7/fd27a1f3dd4a0478e921cace5476381c_XXL.jpg",
    "title": "El retorno (Temp. 6- 01)",
    "description": "Vuelve el podcast de referencia en espa\u0026ntilde;ol sobre los Miami Dolphins.\r\nEn esta ocasi\u0026oacute;n, Fernando en solitario nos hace un breve resumen de la offseason del equipo de Miami, y una peque\u0026ntilde;a previa del partido contra los Charguers.\r\n\r\nEs el arranque de la temporada, y esperamos poder contar los \u0026eacute;xitos del equipo durante toda la temporada. Vamos all\u0026aacute;,\r\n#FinsUp",
    "dateAndTime": "2023-09-08T17:56:01Z",
    "link": "https://www.ivoox.com/retorno-temp-6-01-audios-mp3_rf_115694805_1.html",
    "audio": "https://www.ivoox.com/retorno-temp-6-01_mf_115694805_feed_1.mp3",
    "len": "48:14"
  }
]
